{
  "$schema": "https://json-schema.org/draft/2020-12/schema",
  "title": "ToolSpeedBenchmarkProtocolSchemaV3",
  "type": "object",
  "additionalProperties": false,
  "required": [
    "plan_id",
    "plan_version",
    "status",
    "is_frozen",
    "author",
    "date",
    "git_sha_at_authoring",
    "purpose",
    "previous_protocol_reference",
    "description",
    "workload_fixture_version",
    "required_metric_policy_version",
    "evidence_levels",
    "supported_execution_modes",
    "seeds",
    "trials_per_seed",
    "timing_sources",
    "warmup_policy",
    "statistical_rules",
    "required_metrics",
    "hypothesis_verdict_rules",
    "missing_data_rule",
    "failure_handling",
    "cost_rule",
    "safety_rule",
    "stop_rule",
    "amendment_process",
    "central_hypothesis",
    "mechanisms",
    "controls"
  ],
  "properties": {
    "$schema": {
      "type": "string"
    },
    "plan_id": {
      "type": "string",
      "minLength": 3
    },
    "plan_version": {
      "type": "string",
      "pattern": "^[0-9]+\\.[0-9]+\\.[0-9]+(-[a-zA-Z0-9.]+)?$"
    },
    "status": {
      "type": "string",
      "enum": ["draft", "prospective_draft", "retrospective_repair", "prospectively_frozen"]
    },
    "is_frozen": {
      "type": "boolean"
    },
    "author": {
      "type": "string",
      "minLength": 3
    },
    "date": {
      "type": "string",
      "pattern": "^[0-9]{4}-[0-9]{2}-[0-9]{2}$"
    },
    "git_sha_at_authoring": {
      "type": "string",
      "minLength": 7
    },
    "purpose": {
      "type": "string",
      "minLength": 10
    },
    "previous_protocol_reference": {
      "type": "string"
    },
    "description": {
      "type": "string",
      "minLength": 10
    },
    "workload_fixture_version": {
      "type": "string",
      "pattern": "^[0-9]+\\.[0-9]+\\.[0-9]+$"
    },
    "required_metric_policy_version": {
      "type": "string",
      "pattern": "^[0-9]+\\.[0-9]+\\.[0-9]+$"
    },
    "evidence_levels": {
      "type": "array",
      "items": {
        "type": "string",
        "enum": ["synthetic", "replay_integration", "local_wall_clock", "live_production"]
      },
      "minItems": 1,
      "uniqueItems": true
    },
    "supported_execution_modes": {
      "type": "array",
      "items": {
        "type": "string",
        "enum": ["smoke", "exploratory", "confirmatory"]
      },
      "minItems": 3,
      "uniqueItems": true
    },
    "seeds": {
      "type": "object",
      "additionalProperties": false,
      "required": ["exploratory", "confirmatory"],
      "properties": {
        "exploratory": {
          "type": "array",
          "items": { "type": "integer" },
          "minItems": 3,
          "uniqueItems": true
        },
        "confirmatory": {
          "type": "array",
          "items": { "type": "integer" },
          "minItems": 3,
          "uniqueItems": true
        }
      }
    },
    "trials_per_seed": {
      "type": "object",
      "additionalProperties": false,
      "required": ["replay_integration", "local_wall_clock"],
      "properties": {
        "replay_integration": {
          "type": "integer",
          "minimum": 1000
        },
        "local_wall_clock": {
          "type": "integer",
          "minimum": 200
        }
      }
    },
    "smoke_trials_per_seed": {
      "type": "integer",
      "minimum": 1
    },
    "timing_sources": {
      "type": "object",
      "additionalProperties": false,
      "required": ["replay_integration", "local_wall_clock"],
      "properties": {
        "replay_integration": {
          "type": "string",
          "enum": ["virtual_clock"]
        },
        "local_wall_clock": {
          "type": "string",
          "enum": ["monotonic_wall_clock"]
        }
      }
    },
    "warmup_policy": {
      "type": "object",
      "additionalProperties": false,
      "required": ["trials", "symmetric", "isolated", "excluded_from_evidence"],
      "properties": {
        "trials": {
          "type": "integer",
          "minimum": 0
        },
        "symmetric": {
          "type": "boolean"
        },
        "isolated": {
          "type": "boolean"
        },
        "excluded_from_evidence": {
          "type": "boolean"
        }
      }
    },
    "statistical_rules": {
      "type": "object",
      "additionalProperties": false,
      "required": [
        "bootstrap_resamples",
        "bootstrap_ci",
        "confidence_bound_rule",
        "pairing_rule",
        "multiplicity_policy",
        "paired_difference",
        "p_value_threshold",
        "min_trials_per_seed"
      ],
      "properties": {
        "bootstrap_resamples": {
          "type": "integer",
          "minimum": 2000
        },
        "bootstrap_ci": {
          "type": "number",
          "minimum": 0.5,
          "maximum": 0.999
        },
        "confidence_bound_rule": {
          "type": "string",
          "enum": ["one_sided_lower_bound_exceeds_threshold", "two_sided_interval_exceeds_threshold"]
        },
        "pairing_rule": {
          "type": "string",
          "enum": ["stratified_paired_index_bootstrap"]
        },
        "multiplicity_policy": {
          "type": "string",
          "enum": ["holm_bonferroni", "benjamini_hochberg", "bonferroni", "none"]
        },
        "paired_difference": {
          "type": "boolean"
        },
        "p_value_threshold": {
          "type": "number",
          "minimum": 0.001,
          "maximum": 0.10
        },
        "min_trials_per_seed": {
          "type": "object",
          "additionalProperties": false,
          "required": ["replay_integration", "local_wall_clock"],
          "properties": {
            "replay_integration": {
              "type": "integer",
              "minimum": 1000
            },
            "local_wall_clock": {
              "type": "integer",
              "minimum": 200
            }
          }
        }
      }
    },
    "required_metrics": {
      "type": "array",
      "items": {
        "type": "string",
        "enum": [
          "p95_ccl_ms",
          "p95_speedup",
          "p99_ccl_ms",
          "candidate_success_rate",
          "baseline_success_rate",
          "relative_success_delta",
          "cost_multiplier",
          "memory_high_water_mark_mb",
          "safety_violations_count"
        ]
      },
      "minItems": 9,
      "uniqueItems": true
    },
    "hypothesis_verdict_rules": {
      "type": "object",
      "additionalProperties": false,
      "required": ["pass_rule", "falsified_rule", "inconclusive_rule"],
      "properties": {
        "pass_rule": {
          "type": "string"
        },
        "falsified_rule": {
          "type": "string"
        },
        "inconclusive_rule": {
          "type": "string"
        }
      }
    },
    "missing_data_rule": {
      "type": "string",
      "enum": ["strict_fail_closed_inconclusive", "penalized_timeout"]
    },
    "failure_handling": {
      "type": "object",
      "additionalProperties": false,
      "required": ["unsuccessful_trial_ccl_policy", "success_rate_difference_test"],
      "properties": {
        "unsuccessful_trial_ccl_policy": {
          "type": "string",
          "enum": ["conditional_on_both_success", "restricted_mean_survival_time"]
        },
        "success_rate_difference_test": {
          "type": "string",
          "enum": ["paired_difference_ci_lower_bound_non_inferior"]
        }
      }
    },
    "cost_rule": {
      "type": "string"
    },
    "safety_rule": {
      "type": "string"
    },
    "stop_rule": {
      "type": "string"
    },
    "amendment_process": {
      "type": "string"
    },
    "central_hypothesis": {
      "type": "object",
      "additionalProperties": false,
      "required": ["name", "description", "aggregation_rule"],
      "properties": {
        "name": {
          "type": "string"
        },
        "description": {
          "type": "string"
        },
        "aggregation_rule": {
          "type": "string",
          "enum": ["conjunction_all_primary_mechanisms"]
        }
      }
    },
    "mechanisms": {
      "type": "object",
      "additionalProperties": false,
      "patternProperties": {
        "^[A-Za-z0-9_]+$": {
          "type": "object",
          "additionalProperties": false,
          "required": [
            "name",
            "mechanism_type",
            "candidate",
            "primary_attribution_baseline",
            "practical_baseline",
            "thresholds"
          ],
          "properties": {
            "name": {
              "type": "string"
            },
            "status": {
              "type": "string",
              "enum": ["ACTIVE", "UNIMPLEMENTED"]
            },
            "mechanism_type": {
              "type": "string",
              "enum": [
                "execution_graph_parallelism",
                "fused_serial_pipeline",
                "speculative_read_dispatch",
                "locality_caching",
                "streaming_commit_horizon",
                "cold_start_pool_prewarming",
                "safety_invariant_gate",
                "transactional_authority_overhead",
                "transport_codec",
                "model_action_tokens"
              ]
            },
            "candidate": {
              "type": "string"
            },
            "primary_attribution_baseline": {
              "type": "string"
            },
            "practical_baseline": {
              "type": "string"
            },
            "reference_paper": {
              "type": "string"
            },
            "description": {
              "type": "string"
            },
            "thresholds": {
              "type": "object",
              "additionalProperties": false,
              "required": [
                "min_p95_speedup_efficacy",
                "min_candidate_success_rate",
                "max_allowable_success_drop",
                "min_p99_speedup_non_regression",
                "max_cost_multiplier",
                "max_unapproved_side_effects",
                "max_duplicate_commits"
              ],
              "properties": {
                "min_p95_speedup_efficacy": {
                  "type": "number",
                  "minimum": 0.5
                },
                "min_candidate_success_rate": {
                  "type": "number",
                  "minimum": 0.0,
                  "maximum": 1.0
                },
                "max_allowable_success_drop": {
                  "type": "number",
                  "minimum": 0.0,
                  "maximum": 1.0
                },
                "min_p99_speedup_non_regression": {
                  "type": "number",
                  "minimum": 0.5
                },
                "max_cost_multiplier": {
                  "type": "number",
                  "minimum": 0.5
                },
                "max_unapproved_side_effects": {
                  "type": "integer",
                  "minimum": 0
                },
                "max_duplicate_commits": {
                  "type": "integer",
                  "minimum": 0
                },
                "min_compression_ratio": {
                  "type": "number",
                  "minimum": 0.1
                },
                "max_decode_error_rate": {
                  "type": "number",
                  "minimum": 0.0,
                  "maximum": 1.0
                }
              }
            }
          }
        }
      }
    },
    "controls": {
      "type": "object",
      "additionalProperties": false,
      "required": ["negative_controls", "positive_sensitivity_control"],
      "properties": {
        "negative_controls": {
          "type": "array",
          "minItems": 1,
          "items": {
            "type": "object",
            "additionalProperties": false,
            "required": ["id", "description", "baseline_cls", "candidate_cls", "expected_p95_speedup_range"],
            "properties": {
              "id": {
                "type": "string"
              },
              "description": {
                "type": "string"
              },
              "baseline_cls": {
                "type": "string"
              },
              "candidate_cls": {
                "type": "string"
              },
              "expected_p95_speedup_range": {
                "type": "array",
                "items": {
                  "type": "number"
                },
                "minItems": 2,
                "maxItems": 2
              }
            }
          }
        },
        "positive_sensitivity_control": {
          "type": "object",
          "additionalProperties": false,
          "required": [
            "id",
            "description",
            "injected_delay_ms",
            "expected_p95_speedup_range"
          ],
          "properties": {
            "id": {
              "type": "string"
            },
            "description": {
              "type": "string"
            },
            "injected_delay_ms": {
              "type": "number",
              "minimum": 1.0
            },
            "expected_p95_speedup_range": {
              "type": "array",
              "items": {
                "type": "number"
              },
              "minItems": 2,
              "maxItems": 2
            }
          }
        }
      }
    },
    "amendment_ledger": {
      "type": "array",
      "items": {
        "type": "object",
        "additionalProperties": false,
        "required": ["version", "date", "changes"],
        "properties": {
          "version": {
            "type": "string"
          },
          "date": {
            "type": "string"
          },
          "changes": {
            "type": "array",
            "items": {
              "type": "string"
            }
          }
        }
      }
    }
  }
}
